id_proposta,codigo,data_hora,titulo,sub-titulo,paragrafos,votos_publicos
32922020,PL   Nº 3292/2020,060520211532,Projeto prevê compra mínima de leite de produtores locais para merenda escolar,Leite deverá ser comprado preferencialmente in natura,"O Projeto de Lei 3292/20 determina que pelo menos 40% dos repasses federais para merenda escolar destinados à compra de leite serão usados em aquisições de laticínios locais registrados, permitindo inclusive a dispensa de licitação se o preço for compatível com o do mercado local.O texto, que tramita na Câmara dos Deputados, é do deputado Vitor Hugo (PSL-GO) e altera a lei que trata da merenda escolar na rede pública de educação básica (Lei 11.947/09).Pablo Valadares/Câmara dos DeputadosVitor Hugo propõe dispensa de licitação se o preço for compatível com o do mercado localO parlamentar afirma que a mudança permite a “dinamização da produção regional de leite e promove a geração de renda nas localidades em que se encontram os estudantes que consomem o produto”.Dispensa        Pela proposta, o leite deverá ser comprado in natura – a versão em pó apenas se a primeira opção não for possível e sempre de produtor nacional de leite.Só haverá dispensa do cumprimento do percentual mínimo de 40% se os produtores locais não puderem emitir nota fiscal ou apresentarem condições sanitárias de produção inadequadas.O projeto prevê também a redução de alimentos ultraprocessados na merenda escolar, como biscoitos e sucos de caixinha.Programa        O Programa Nacional de Alimentação Escolar (PNAE), que o projeto modifica, destina recursos federais diretamente aos estados e municípios, com base no Censo Escolar.São atendidos pelo programa os alunos de todo o ciclo básico (educação infantil, ensino fundamental, ensino médio e educação de jovens e adultos) matriculados em escolas públicas, filantrópicas e em entidades comunitárias (conveniadas com o poder público).Tramitação        O projeto tramita em regime de urgência e será analisado diretamente no Plenário da Câmara.Saiba mais sobre a tramitação de projetos de leiO Projeto de Lei 3292/20 determina que pelo menos 40% dos repasses federais para merenda escolar destinados à compra de leite serão usados em aquisições de laticínios locais registrados, permitindo inclusive a dispensa de licitação se o preço for compatível com o do mercado local.O texto, que tramita na Câmara dos Deputados, é do deputado Vitor Hugo (PSL-GO) e altera a lei que trata da merenda escolar na rede pública de educação básica (Lei 11.947/09).O parlamentar afirma que a mudança permite a “dinamização da produção regional de leite e promove a geração de renda nas localidades em que se encontram os estudantes que consomem o produto”.Dispensa        Pela proposta, o leite deverá ser comprado in natura – a versão em pó apenas se a primeira opção não for possível e sempre de produtor nacional de leite.Só haverá dispensa do cumprimento do percentual mínimo de 40% se os produtores locais não puderem emitir nota fiscal ou apresentarem condições sanitárias de produção inadequadas.O projeto prevê também a redução de alimentos ultraprocessados na merenda escolar, como biscoitos e sucos de caixinha.Programa        O Programa Nacional de Alimentação Escolar (PNAE), que o projeto modifica, destina recursos federais diretamente aos estados e municípios, com base no Censo Escolar.São atendidos pelo programa os alunos de todo o ciclo básico (educação infantil, ensino fundamental, ensino médio e educação de jovens e adultos) matriculados em escolas públicas, filantrópicas e em entidades comunitárias (conveniadas com o poder público).Tramitação        O projeto tramita em regime de urgência e será analisado diretamente no Plenário da Câmara.Saiba mais sobre a tramitação de projetos de leiReportagem – Janary JúniorEdição – Cláudia Lemos",170
32922020,PL   Nº 3292/2020,060520211602,Projeto prevê compra mínima de leite de produtores locais para merenda escolar,Leite deverá ser comprado preferencialmente in natura,"O Projeto de Lei 3292/20 determina que pelo menos 40% dos repasses federais para merenda escolar destinados à compra de leite serão usados em aquisições de laticínios locais registrados, permitindo inclusive a dispensa de licitação se o preço for compatível com o do mercado local.O texto, que tramita na Câmara dos Deputados, é do deputado Vitor Hugo (PSL-GO) e altera a lei que trata da merenda escolar na rede pública de educação básica (Lei 11.947/09).Pablo Valadares/Câmara dos DeputadosVitor Hugo propõe dispensa de licitação se o preço for compatível com o do mercado localO parlamentar afirma que a mudança permite a “dinamização da produção regional de leite e promove a geração de renda nas localidades em que se encontram os estudantes que consomem o produto”.Dispensa        Pela proposta, o leite deverá ser comprado in natura – a versão em pó apenas se a primeira opção não for possível e sempre de produtor nacional de leite.Só haverá dispensa do cumprimento do percentual mínimo de 40% se os produtores locais não puderem emitir nota fiscal ou apresentarem condições sanitárias de produção inadequadas.O projeto prevê também a redução de alimentos ultraprocessados na merenda escolar, como biscoitos e sucos de caixinha.Programa        O Programa Nacional de Alimentação Escolar (PNAE), que o projeto modifica, destina recursos federais diretamente aos estados e municípios, com base no Censo Escolar.São atendidos pelo programa os alunos de todo o ciclo básico (educação infantil, ensino fundamental, ensino médio e educação de jovens e adultos) matriculados em escolas públicas, filantrópicas e em entidades comunitárias (conveniadas com o poder público).Tramitação        O projeto tramita em regime de urgência e será analisado diretamente no Plenário da Câmara.Saiba mais sobre a tramitação de projetos de leiO Projeto de Lei 3292/20 determina que pelo menos 40% dos repasses federais para merenda escolar destinados à compra de leite serão usados em aquisições de laticínios locais registrados, permitindo inclusive a dispensa de licitação se o preço for compatível com o do mercado local.O texto, que tramita na Câmara dos Deputados, é do deputado Vitor Hugo (PSL-GO) e altera a lei que trata da merenda escolar na rede pública de educação básica (Lei 11.947/09).O parlamentar afirma que a mudança permite a “dinamização da produção regional de leite e promove a geração de renda nas localidades em que se encontram os estudantes que consomem o produto”.Dispensa        Pela proposta, o leite deverá ser comprado in natura – a versão em pó apenas se a primeira opção não for possível e sempre de produtor nacional de leite.Só haverá dispensa do cumprimento do percentual mínimo de 40% se os produtores locais não puderem emitir nota fiscal ou apresentarem condições sanitárias de produção inadequadas.O projeto prevê também a redução de alimentos ultraprocessados na merenda escolar, como biscoitos e sucos de caixinha.Programa        O Programa Nacional de Alimentação Escolar (PNAE), que o projeto modifica, destina recursos federais diretamente aos estados e municípios, com base no Censo Escolar.São atendidos pelo programa os alunos de todo o ciclo básico (educação infantil, ensino fundamental, ensino médio e educação de jovens e adultos) matriculados em escolas públicas, filantrópicas e em entidades comunitárias (conveniadas com o poder público).Tramitação        O projeto tramita em regime de urgência e será analisado diretamente no Plenário da Câmara.Saiba mais sobre a tramitação de projetos de leiReportagem – Janary JúniorEdição – Cláudia Lemos",170
32922020,PL   Nº 3292/2020,060520211617,Projeto prevê compra mínima de leite de produtores locais para merenda escolar,Leite deverá ser comprado preferencialmente in natura,"O Projeto de Lei 3292/20 determina que pelo menos 40% dos repasses federais para merenda escolar destinados à compra de leite serão usados em aquisições de laticínios locais registrados, permitindo inclusive a dispensa de licitação se o preço for compatível com o do mercado local.O texto, que tramita na Câmara dos Deputados, é do deputado Vitor Hugo (PSL-GO) e altera a lei que trata da merenda escolar na rede pública de educação básica (Lei 11.947/09).Pablo Valadares/Câmara dos DeputadosVitor Hugo propõe dispensa de licitação se o preço for compatível com o do mercado localO parlamentar afirma que a mudança permite a “dinamização da produção regional de leite e promove a geração de renda nas localidades em que se encontram os estudantes que consomem o produto”.Dispensa        Pela proposta, o leite deverá ser comprado in natura – a versão em pó apenas se a primeira opção não for possível e sempre de produtor nacional de leite.Só haverá dispensa do cumprimento do percentual mínimo de 40% se os produtores locais não puderem emitir nota fiscal ou apresentarem condições sanitárias de produção inadequadas.O projeto prevê também a redução de alimentos ultraprocessados na merenda escolar, como biscoitos e sucos de caixinha.Programa        O Programa Nacional de Alimentação Escolar (PNAE), que o projeto modifica, destina recursos federais diretamente aos estados e municípios, com base no Censo Escolar.São atendidos pelo programa os alunos de todo o ciclo básico (educação infantil, ensino fundamental, ensino médio e educação de jovens e adultos) matriculados em escolas públicas, filantrópicas e em entidades comunitárias (conveniadas com o poder público).Tramitação        O projeto tramita em regime de urgência e será analisado diretamente no Plenário da Câmara.Saiba mais sobre a tramitação de projetos de leiO Projeto de Lei 3292/20 determina que pelo menos 40% dos repasses federais para merenda escolar destinados à compra de leite serão usados em aquisições de laticínios locais registrados, permitindo inclusive a dispensa de licitação se o preço for compatível com o do mercado local.O texto, que tramita na Câmara dos Deputados, é do deputado Vitor Hugo (PSL-GO) e altera a lei que trata da merenda escolar na rede pública de educação básica (Lei 11.947/09).O parlamentar afirma que a mudança permite a “dinamização da produção regional de leite e promove a geração de renda nas localidades em que se encontram os estudantes que consomem o produto”.Dispensa        Pela proposta, o leite deverá ser comprado in natura – a versão em pó apenas se a primeira opção não for possível e sempre de produtor nacional de leite.Só haverá dispensa do cumprimento do percentual mínimo de 40% se os produtores locais não puderem emitir nota fiscal ou apresentarem condições sanitárias de produção inadequadas.O projeto prevê também a redução de alimentos ultraprocessados na merenda escolar, como biscoitos e sucos de caixinha.Programa        O Programa Nacional de Alimentação Escolar (PNAE), que o projeto modifica, destina recursos federais diretamente aos estados e municípios, com base no Censo Escolar.São atendidos pelo programa os alunos de todo o ciclo básico (educação infantil, ensino fundamental, ensino médio e educação de jovens e adultos) matriculados em escolas públicas, filantrópicas e em entidades comunitárias (conveniadas com o poder público).Tramitação        O projeto tramita em regime de urgência e será analisado diretamente no Plenário da Câmara.Saiba mais sobre a tramitação de projetos de leiReportagem – Janary JúniorEdição – Cláudia Lemos",170
15612020,PL   Nº 1561/2020,050520212145,Proposta cria Loteria da Saúde para financiar SUS e combate à Covid-19,Concurso exigirá regulamentação pelo Ministério da Economia,"Pablo Valadares/Câmara dos DeputadosDeputado Capitão Wagner, autor do projeto de leiO Projeto de Lei 1561/20 cria a Loteria da Saúde, modalidade de concurso de prognósticos numéricos destinada a financiar o Sistema Único de Saúde (SUS). Excepcionalmente, os recursos poderão ser usados para ações de prevenção, contenção, combate e mitigação dos efeitos da pandemia do novo coronavírus.A proposta em tramitação na Câmara dos Deputados determina que a regulamentação caberá ao Ministério da Economia, respeitados o Decreto-Lei 204/67, que trata da exploração de loterias no País, e a Lei 6.717/79, que autoriza a Caixa Econômica Federal a realizar os concursos da Loteria Federal.“A manutenção do SUS exige substancial aporte de recursos, tornando sempre presente a busca de novas fontes de receita sem que haja a necessidade de criação de novos tributos”, disse o autor, deputado Capitão Wagner (Pros-CE), destacando que o texto baseia-se em proposta já arquivada (PL 1413/15).Tramitação        O projeto tramita em caráter conclusivo e será analisado pelas comissões de Seguridade Social e Família; de Finanças e Tributação; e de Constituição e Justiça e de Cidadania.Saiba mais sobre a tramitação de projetos de leiO Projeto de Lei 1561/20 cria a Loteria da Saúde, modalidade de concurso de prognósticos numéricos destinada a financiar o Sistema Único de Saúde (SUS). Excepcionalmente, os recursos poderão ser usados para ações de prevenção, contenção, combate e mitigação dos efeitos da pandemia do novo coronavírus.A proposta em tramitação na Câmara dos Deputados determina que a regulamentação caberá ao Ministério da Economia, respeitados o Decreto-Lei 204/67, que trata da exploração de loterias no País, e a Lei 6.717/79, que autoriza a Caixa Econômica Federal a realizar os concursos da Loteria Federal.“A manutenção do SUS exige substancial aporte de recursos, tornando sempre presente a busca de novas fontes de receita sem que haja a necessidade de criação de novos tributos”, disse o autor, deputado Capitão Wagner (Pros-CE), destacando que o texto baseia-se em proposta já arquivada (PL 1413/15).Tramitação        O projeto tramita em caráter conclusivo e será analisado pelas comissões de Seguridade Social e Família; de Finanças e Tributação; e de Constituição e Justiça e de Cidadania.Saiba mais sobre a tramitação de projetos de leiReportagem – Ralph MachadoEdição – Roberto Seabra",24
84202017,PL   Nº 8420/2017,300620211935,Proposta altera composição do Conselho de Assistência Social,"O órgão, que reúne representantes do governo e da sociedade civil para discutir e fiscalizar a prestação de serviços sociais, está vinculado à estrutura do Ministério de Desenvolvimento Social","A Câmara analisa o Projeto de Lei 8420/17, da deputada Luiza Erundina (Psol-SP), que altera a composição do Conselho Nacional de Assistência Social (CNAS).Alex Ferreira / Câmara dos DeputadosErundina: o projeto garante paridade entre governo, entidades sociais, trabalhadores e usuários da política de assistência socialHoje o Conselho é composto por 18 membros, cujos nomes são indicados de acordo com seguintes critérios:        - nove representantes governamentais (incluindo um representante dos estados e um dos municípios); e        - nove representantes da sociedade civil.A proposta de Erundina aumenta o número de integrantes de 18 para 20, divididos da seguinte maneira:        - cinco representantes governamentais (incluindo um representante dos estados e um dos municípios);        - cinco representantes de usuários da política de assistência social;        - cinco representantes dos trabalhadores públicos e ou privados; e         - cinco representantes das entidades de assistência social.A deputada explica que a nova composição é um pleito da Conferência Nacional de Assistência Social de 2015. A intenção, segundo ela, é atender de forma plena ao dispositivo constitucional (art. 194) que busca garantir o caráter democrático e a descentralização da administração mediante gestão quadripartite.Tramitação        O projeto, que tramita em caráter conclusivo, será analisado pelas comissões de Seguridade Social e Família; de Trabalho, de Administração e Serviço Público; e de Constituição e Justiça e de Cidadania.A Câmara analisa o Projeto de Lei 8420/17, da deputada Luiza Erundina (Psol-SP), que altera a composição do Conselho Nacional de Assistência Social (CNAS).Hoje o Conselho é composto por 18 membros, cujos nomes são indicados de acordo com seguintes critérios:        - nove representantes governamentais (incluindo um representante dos estados e um dos municípios); e        - nove representantes da sociedade civil.A proposta de Erundina aumenta o número de integrantes de 18 para 20, divididos da seguinte maneira:        - cinco representantes governamentais (incluindo um representante dos estados e um dos municípios);        - cinco representantes de usuários da política de assistência social;        - cinco representantes dos trabalhadores públicos e ou privados; e         - cinco representantes das entidades de assistência social.A deputada explica que a nova composição é um pleito da Conferência Nacional de Assistência Social de 2015. A intenção, segundo ela, é atender de forma plena ao dispositivo constitucional (art. 194) que busca garantir o caráter democrático e a descentralização da administração mediante gestão quadripartite.Tramitação        O projeto, que tramita em caráter conclusivo, será analisado pelas comissões de Seguridade Social e Família; de Trabalho, de Administração e Serviço Público; e de Constituição e Justiça e de Cidadania.Reportagem - Natalia Doederlein Edição - Marcia Becker",5
