id_proposta,codigo,data_hora,titulo,sub-titulo,paragrafos,votos_publicos
109202018,PL   Nº 10920/2018,290620211921,Proposta ajusta Lei de Propriedade Industrial para adesão do Brasil a acordo internacional,sub-titulo,"Cleia Viana/Câmara dos DeputadosLopes: O projeto traz medidas para que a adesão ao tratado não gere assimetrias indesejadas entre nacionais e estrangeirosTramita na Câmara dos Deputados o Projeto de Lei 10920/18, do deputado Julio Lopes (PP-RJ), que ajusta a Lei de Propriedade Industrial (LPI, 9.279/96) para a adesão do País ao Protocolo de Madri.Esse acordo internacional permite o registro de marcas comerciais, já garantido nos países de origem, em todos os cerca de 120 países integrantes do tratado, que representam 80% do comércio internacional. Isso pode possibilitar redução de custos, menos burocracia e a garantia de que essas marcas comerciais serão protegidas nos mercados internacionais. Apesar do pedido único, cada país fará o exame da marca para verificar se está de acordo a legislação de seu país.Segundo Lopes, a adesão do Brasil ao tratado é cada vez mais urgente. “Viabilizar ao empresário brasileiro a simplificação de procedimentos no registro de sua marca em vários países do mundo constitui um importante fator de redução de burocracia e custo.”Lopes disse que os ajustes são “chave” para a adesão ser uma oportunidade para os empresários e não mais um elemento de perda de competitividade.O protocolo é administrado pela Organização Mundial da Propriedade Intelectual (OMPI), que permite solicitar o registro da marca nos países membros por meio de um único pedido, reduzindo custos e procedimentos. O protocolo foi assinado em 1991 e está em vigor desde 1998. A sua base legal é o Acordo de Madrid, assinado em 1891.Combate à pirataria        Entre as mudanças está ampliar uma regra da LPI para impedir a pirataria de marcas para os pedidos de registro feitos por empresas estrangeiras via protocolo. Pela lei atual, as empresas brasileiras só podem pedir registro de marcas sobre produtos relacionados à sua atividade. Assim, uma fabricante de roupas não pode registrar marca de um carro, por exemplo. Pelo projeto, a regra vale também para as empresas estrangeiras.O texto também admite a cotitularidade de marcas, como já está previsto no protocolo. Assim, marcas de invenções fruto de pesquisas em parceria ficam com duas organizações: universidade e empresa.O projeto garante a isonomia de requisitos entre os pedidos de registro de marca apresentados no Brasil e no exterior com base em acordo internacional. “A redação garante o nivelamento pleno entre nacionais e estrangeiros em relação aos requisitos do pedido”, disse Lopes.Prazos        Pela proposta, os pedidos de registro tanto nacionais como estrangeiros deverão ser analisado em até 18 meses. Ao término do prazo, na hipótese de o exame não ser concluído, os registros serão concedidos de forma automática. Atualmente, isso só vale para os países membros do Protocolo de Madri. Para Lopes, a mudança traz um estímulo ao Instituto Nacional da Propriedade Industrial (INPI) para examinar os pedidos no “menor espaço de tempo viável” para a autarquia federal.A proposta também obriga a empresa estrangeira detentora de marca a manter procurador habilitado no Brasil para reduzir burocracia relacionada à eventual contestação de direitos de marca. “A inexistência dessa obrigação daria às empresas estrangeiras, na prática, uma quase imunidade a processos judiciais no Brasil”, afirmou Lopes.Marca sem uso        Pelo projeto, se uma marca não estiver em uso ao longo do último ano de vigência ela perderá o registro. O uso precisa ser comprovado por declaração ao INPI com indicação de produtos e serviços ou com justificativa sobre o desuso. A caducidade também vale para desuso durante o sexto ano de vigência do registro, contado da concessão ou prorrogação do pedido.Lopes afirmou que o direito de exclusividade da marca só se justifica com o uso. Caso contrário, constitui um “capital morto” para a sociedade, que “mais atrapalha que ajuda”. Esse tipo de prática é chamado de ""deadwood”.Ratificação        Proposta em tramitação na Câmara (PDC 860/17) ratifica o protocolo e foi aprovada pela Comissão de Relações Exteriores e Defesa Nacional em novembro de 2017 e pela Comissão de Desenvolvimento Econômico, Indústria, Comércio e Serviços em novembro deste ano. O texto tramita em regime de urgência e ainda precisa ser votado pela CCJ e pelo Plenário.Tramitação        O PL 10920/18 tramita em caráter conclusivo e será analisado pelas comissões de Desenvolvimento Econômico, Indústria, Comércio e Serviços; e de Constituição e Justiça e de Cidadania.Tramita na Câmara dos Deputados o Projeto de Lei 10920/18, do deputado Julio Lopes (PP-RJ), que ajusta a Lei de Propriedade Industrial (LPI, 9.279/96) para a adesão do País ao Protocolo de Madri.Esse acordo internacional permite o registro de marcas comerciais, já garantido nos países de origem, em todos os cerca de 120 países integrantes do tratado, que representam 80% do comércio internacional. Isso pode possibilitar redução de custos, menos burocracia e a garantia de que essas marcas comerciais serão protegidas nos mercados internacionais. Apesar do pedido único, cada país fará o exame da marca para verificar se está de acordo a legislação de seu país.Segundo Lopes, a adesão do Brasil ao tratado é cada vez mais urgente. “Viabilizar ao empresário brasileiro a simplificação de procedimentos no registro de sua marca em vários países do mundo constitui um importante fator de redução de burocracia e custo.”Lopes disse que os ajustes são “chave” para a adesão ser uma oportunidade para os empresários e não mais um elemento de perda de competitividade.O protocolo é administrado pela Organização Mundial da Propriedade Intelectual (OMPI), que permite solicitar o registro da marca nos países membros por meio de um único pedido, reduzindo custos e procedimentos. O protocolo foi assinado em 1991 e está em vigor desde 1998. A sua base legal é o Acordo de Madrid, assinado em 1891.Combate à pirataria        Entre as mudanças está ampliar uma regra da LPI para impedir a pirataria de marcas para os pedidos de registro feitos por empresas estrangeiras via protocolo. Pela lei atual, as empresas brasileiras só podem pedir registro de marcas sobre produtos relacionados à sua atividade. Assim, uma fabricante de roupas não pode registrar marca de um carro, por exemplo. Pelo projeto, a regra vale também para as empresas estrangeiras.O texto também admite a cotitularidade de marcas, como já está previsto no protocolo. Assim, marcas de invenções fruto de pesquisas em parceria ficam com duas organizações: universidade e empresa.O projeto garante a isonomia de requisitos entre os pedidos de registro de marca apresentados no Brasil e no exterior com base em acordo internacional. “A redação garante o nivelamento pleno entre nacionais e estrangeiros em relação aos requisitos do pedido”, disse Lopes.Prazos        Pela proposta, os pedidos de registro tanto nacionais como estrangeiros deverão ser analisado em até 18 meses. Ao término do prazo, na hipótese de o exame não ser concluído, os registros serão concedidos de forma automática. Atualmente, isso só vale para os países membros do Protocolo de Madri. Para Lopes, a mudança traz um estímulo ao Instituto Nacional da Propriedade Industrial (INPI) para examinar os pedidos no “menor espaço de tempo viável” para a autarquia federal.A proposta também obriga a empresa estrangeira detentora de marca a manter procurador habilitado no Brasil para reduzir burocracia relacionada à eventual contestação de direitos de marca. “A inexistência dessa obrigação daria às empresas estrangeiras, na prática, uma quase imunidade a processos judiciais no Brasil”, afirmou Lopes.Marca sem uso        Pelo projeto, se uma marca não estiver em uso ao longo do último ano de vigência ela perderá o registro. O uso precisa ser comprovado por declaração ao INPI com indicação de produtos e serviços ou com justificativa sobre o desuso. A caducidade também vale para desuso durante o sexto ano de vigência do registro, contado da concessão ou prorrogação do pedido.Lopes afirmou que o direito de exclusividade da marca só se justifica com o uso. Caso contrário, constitui um “capital morto” para a sociedade, que “mais atrapalha que ajuda”. Esse tipo de prática é chamado de ""deadwood”.Ratificação        Proposta em tramitação na Câmara (PDC 860/17) ratifica o protocolo e foi aprovada pela Comissão de Relações Exteriores e Defesa Nacional em novembro de 2017 e pela Comissão de Desenvolvimento Econômico, Indústria, Comércio e Serviços em novembro deste ano. O texto tramita em regime de urgência e ainda precisa ser votado pela CCJ e pelo Plenário.Tramitação        O PL 10920/18 tramita em caráter conclusivo e será analisado pelas comissões de Desenvolvimento Econômico, Indústria, Comércio e Serviços; e de Constituição e Justiça e de Cidadania.Reportagem - Tiago MirandaEdição - Marcia Becker",0
12082021,PL   Nº 1208/2021,150620211647,Projeto cria programa de incentivo a pesquisa sobre a Covid,Empresas poderão fazer doações dedutíveis do Imposto de Renda,"Pablo Valadares/Câmara dos DeputadosJordy: “Emergência sanitária justifica a medida, mesmo com impacto fiscal""O Projeto de Lei 1208/21 cria o Programa Pró-Pesquisa Covid-19. O objetivo é incentivar empresas a doar recursos próprios, dedutíveis do Imposto de Renda, a instituições de pesquisa e desenvolvimento de produtos para reduzir os efeitos sanitários da Covid-19.O autor da proposta, deputado Carlos Jordy (PSL-RJ), justifica que a pandemia, agravada nos primeiros meses de 2021 no Brasil, só será controlada a partir do desenvolvimento de medicamentos, tratamentos, vacinas e equipamentos médico-hospitalares em ampla escala.A proposição limita os efeitos financeiros da dedução de imposto a R$ 1 bilhão. “O momento de emergência sanitária justifica a medida, mesmo com impacto fiscal. Afinal, a rápida mitigação da pandemia e de seus desdobramentos econômicos é capaz de contribuir significativamente para a redução de gastos com ela, contribuindo para a célere retomada econômica”, defende Jordy.Habilitação prévia        O texto determina ainda que as instituições aptas a receber os recursos deverão ser previamente habilitadas pelo Ministério da Saúde.Conforme a matéria, as instituições deverão apresentar seus estudos ao ministério, que deverá se manifestar em até 10 dias a partir da solicitação. Os estudos deverão informar as estimativas de custos e o montante já disponível para sua realização.Caso alguma instituição receba mais recursos que os estimados, a parcela excedente deverá ser encaminhada ao Ministério da Saúde para redistribuição a instituições que tiverem recebido menos recursos.Se for aprovada e virar lei, a medida valerá enquanto durar a emergência de saúde pública decorrente da pandemia. Poderão participar as empresas que declaram o Imposto de Renda na modalidade Lucro Real.Tramitação        O projeto tramita em regime de urgência em conjunto com outras propostas e pode ser votado a qualquer momento pelo Plenário.Saiba mais sobre a tramitação de projetos de leiO Projeto de Lei 1208/21 cria o Programa Pró-Pesquisa Covid-19. O objetivo é incentivar empresas a doar recursos próprios, dedutíveis do Imposto de Renda, a instituições de pesquisa e desenvolvimento de produtos para reduzir os efeitos sanitários da Covid-19.O autor da proposta, deputado Carlos Jordy (PSL-RJ), justifica que a pandemia, agravada nos primeiros meses de 2021 no Brasil, só será controlada a partir do desenvolvimento de medicamentos, tratamentos, vacinas e equipamentos médico-hospitalares em ampla escala.A proposição limita os efeitos financeiros da dedução de imposto a R$ 1 bilhão. “O momento de emergência sanitária justifica a medida, mesmo com impacto fiscal. Afinal, a rápida mitigação da pandemia e de seus desdobramentos econômicos é capaz de contribuir significativamente para a redução de gastos com ela, contribuindo para a célere retomada econômica”, defende Jordy.Habilitação prévia        O texto determina ainda que as instituições aptas a receber os recursos deverão ser previamente habilitadas pelo Ministério da Saúde.Conforme a matéria, as instituições deverão apresentar seus estudos ao ministério, que deverá se manifestar em até 10 dias a partir da solicitação. Os estudos deverão informar as estimativas de custos e o montante já disponível para sua realização.Caso alguma instituição receba mais recursos que os estimados, a parcela excedente deverá ser encaminhada ao Ministério da Saúde para redistribuição a instituições que tiverem recebido menos recursos.Se for aprovada e virar lei, a medida valerá enquanto durar a emergência de saúde pública decorrente da pandemia. Poderão participar as empresas que declaram o Imposto de Renda na modalidade Lucro Real.Tramitação        O projeto tramita em regime de urgência em conjunto com outras propostas e pode ser votado a qualquer momento pelo Plenário.Saiba mais sobre a tramitação de projetos de leiReportagem – Noéli NobreEdição – Cláudia Lemos",11
12082021,PL   Nº 1208/2021,150620211701,Projeto cria programa de incentivo a pesquisa sobre a Covid,Empresas poderão fazer doações dedutíveis do Imposto de Renda,"Pablo Valadares/Câmara dos DeputadosJordy: “Emergência sanitária justifica a medida, mesmo com impacto fiscal""O Projeto de Lei 1208/21 cria o Programa Pró-Pesquisa Covid-19. O objetivo é incentivar empresas a doar recursos próprios, dedutíveis do Imposto de Renda, a instituições de pesquisa e desenvolvimento de produtos para reduzir os efeitos sanitários da Covid-19.O autor da proposta, deputado Carlos Jordy (PSL-RJ), justifica que a pandemia, agravada nos primeiros meses de 2021 no Brasil, só será controlada a partir do desenvolvimento de medicamentos, tratamentos, vacinas e equipamentos médico-hospitalares em ampla escala.A proposição limita os efeitos financeiros da dedução de imposto a R$ 1 bilhão. “O momento de emergência sanitária justifica a medida, mesmo com impacto fiscal. Afinal, a rápida mitigação da pandemia e de seus desdobramentos econômicos é capaz de contribuir significativamente para a redução de gastos com ela, contribuindo para a célere retomada econômica”, defende Jordy.Habilitação prévia        O texto determina ainda que as instituições aptas a receber os recursos deverão ser previamente habilitadas pelo Ministério da Saúde.Conforme a matéria, as instituições deverão apresentar seus estudos ao ministério, que deverá se manifestar em até 10 dias a partir da solicitação. Os estudos deverão informar as estimativas de custos e o montante já disponível para sua realização.Caso alguma instituição receba mais recursos que os estimados, a parcela excedente deverá ser encaminhada ao Ministério da Saúde para redistribuição a instituições que tiverem recebido menos recursos.Se for aprovada e virar lei, a medida valerá enquanto durar a emergência de saúde pública decorrente da pandemia. Poderão participar as empresas que declaram o Imposto de Renda na modalidade Lucro Real.Tramitação        O projeto tramita em regime de urgência em conjunto com outras propostas e pode ser votado a qualquer momento pelo Plenário.Saiba mais sobre a tramitação de projetos de leiO Projeto de Lei 1208/21 cria o Programa Pró-Pesquisa Covid-19. O objetivo é incentivar empresas a doar recursos próprios, dedutíveis do Imposto de Renda, a instituições de pesquisa e desenvolvimento de produtos para reduzir os efeitos sanitários da Covid-19.O autor da proposta, deputado Carlos Jordy (PSL-RJ), justifica que a pandemia, agravada nos primeiros meses de 2021 no Brasil, só será controlada a partir do desenvolvimento de medicamentos, tratamentos, vacinas e equipamentos médico-hospitalares em ampla escala.A proposição limita os efeitos financeiros da dedução de imposto a R$ 1 bilhão. “O momento de emergência sanitária justifica a medida, mesmo com impacto fiscal. Afinal, a rápida mitigação da pandemia e de seus desdobramentos econômicos é capaz de contribuir significativamente para a redução de gastos com ela, contribuindo para a célere retomada econômica”, defende Jordy.Habilitação prévia        O texto determina ainda que as instituições aptas a receber os recursos deverão ser previamente habilitadas pelo Ministério da Saúde.Conforme a matéria, as instituições deverão apresentar seus estudos ao ministério, que deverá se manifestar em até 10 dias a partir da solicitação. Os estudos deverão informar as estimativas de custos e o montante já disponível para sua realização.Caso alguma instituição receba mais recursos que os estimados, a parcela excedente deverá ser encaminhada ao Ministério da Saúde para redistribuição a instituições que tiverem recebido menos recursos.Se for aprovada e virar lei, a medida valerá enquanto durar a emergência de saúde pública decorrente da pandemia. Poderão participar as empresas que declaram o Imposto de Renda na modalidade Lucro Real.Tramitação        O projeto tramita em regime de urgência em conjunto com outras propostas e pode ser votado a qualquer momento pelo Plenário.Saiba mais sobre a tramitação de projetos de leiReportagem – Noéli NobreEdição – Cláudia Lemos",11
34302019,PL   Nº 3430/2019,080620211816,Projeto facilita preservação e recuperação de nascentes,sub-titulo,"O Projeto de Lei 3430/19 autoriza a intervenção e a implantação de instalações necessárias à preservação de nascentes. O texto altera a lei 12.651/12 (Código Florestal) para permitir que atividades visando à captação e condução de água e de efluentes sejam consideradas como de interesse social ou de baixo impacto ambiental.A proposta também dispensa a autorização do órgão competente para a intervenção e implantação de instalações necessárias à recuperação e proteção de nascentes para as pequenas propriedades ou posse rural familiar.Cleia Viana/Câmara dos DeputadosLeandre: proposta confere maior segurança jurídica para as agências promotoras dos programas de recuperação de nascentesDe acordo com a autora do projeto, deputada Leandre (PV-PR), a medida pode valorizar e multiplicar os importantes serviços ambientais prestados pelas áreas de preservação permanente.“A proposta confere maior segurança jurídica para as agências promotoras dos programas de recuperação de nascentes, bem como para os proprietários executores”, explica a parlamentar.TramitaçãoO projeto, que tramita em caráter conclusivo, será analisado pelas comissões de Meio Ambiente e Desenvolvimento Sustentável; e de Constituição e Justiça e de Cidadania.O Projeto de Lei 3430/19 autoriza a intervenção e a implantação de instalações necessárias à preservação de nascentes. O texto altera a lei 12.651/12 (Código Florestal) para permitir que atividades visando à captação e condução de água e de efluentes sejam consideradas como de interesse social ou de baixo impacto ambiental.A proposta também dispensa a autorização do órgão competente para a intervenção e implantação de instalações necessárias à recuperação e proteção de nascentes para as pequenas propriedades ou posse rural familiar.De acordo com a autora do projeto, deputada Leandre (PV-PR), a medida pode valorizar e multiplicar os importantes serviços ambientais prestados pelas áreas de preservação permanente.“A proposta confere maior segurança jurídica para as agências promotoras dos programas de recuperação de nascentes, bem como para os proprietários executores”, explica a parlamentar.TramitaçãoO projeto, que tramita em caráter conclusivo, será analisado pelas comissões de Meio Ambiente e Desenvolvimento Sustentável; e de Constituição e Justiça e de Cidadania.Reportagem – Luiz Gustavo Xavier Edição – Ana Chalub",8
16132021,PL   Nº 1613/2021,150720212155,Proposta define regras no SUS para incorporação de novas tecnologias e medicamentos,Projeto pretende racionalizar o uso de recursos do Sistema Único de Saúde e garantir a eficácia dos tratamentos,"O Projeto de Lei 1613/21, do Senado, define regras para incorporação de novas tecnologias e novos medicamentos destinadas ao tratamento dos pacientes no Sistema Único de Saúde (SUS). O texto em análise na Câmara dos Deputados altera a Lei Orgânica da Saúde.DepositphotosNovos medicamentos deverão comprovar eficácia e segurançaConforme a proposta, será necessário estabelecer parâmetros e indicadores do custo-efetividade das novas tecnologias, bem como critérios de avaliação dos protocolos clínicos e diretrizes terapêuticas, compreendendo os medicamentos e produtos necessários para o tratamento das doenças em diferentes fases.O texto permite que a Comissão Nacional de Incorporação de Tecnologias no SUS (Conitec) autorize o emprego de medicamentos em indicação distinta daquela aprovada no registro do produto, desde que demonstradas as evidências científicas sobre eficácia, acurácia, efetividade e segurança.A proposta foi aprovada pelo Senado no final de abril, na forma do substitutivo apresentado pelo relator, senador Fernando Bezerra Coelho (MDB-PE). Para ele, como novas tecnologias e novos tratamentos surgem o tempo todo e são cada vez mais caros, é necessário avaliar se, de fato, a eficácia deles compensa os custos, permitindo ao SUS o uso racional de recursos limitados.Tramitação        O projeto será analisado pelas comissões de Seguridade Social e Família; e de Constituição e Justiça e de Cidadania. Depois seguirá para o Plenário.Saiba mais sobre a tramitação de projetos de leiO Projeto de Lei 1613/21, do Senado, define regras para incorporação de novas tecnologias e novos medicamentos destinadas ao tratamento dos pacientes no Sistema Único de Saúde (SUS). O texto em análise na Câmara dos Deputados altera a Lei Orgânica da Saúde.Conforme a proposta, será necessário estabelecer parâmetros e indicadores do custo-efetividade das novas tecnologias, bem como critérios de avaliação dos protocolos clínicos e diretrizes terapêuticas, compreendendo os medicamentos e produtos necessários para o tratamento das doenças em diferentes fases.O texto permite que a Comissão Nacional de Incorporação de Tecnologias no SUS (Conitec) autorize o emprego de medicamentos em indicação distinta daquela aprovada no registro do produto, desde que demonstradas as evidências científicas sobre eficácia, acurácia, efetividade e segurança.A proposta foi aprovada pelo Senado no final de abril, na forma do substitutivo apresentado pelo relator, senador Fernando Bezerra Coelho (MDB-PE). Para ele, como novas tecnologias e novos tratamentos surgem o tempo todo e são cada vez mais caros, é necessário avaliar se, de fato, a eficácia deles compensa os custos, permitindo ao SUS o uso racional de recursos limitados.Tramitação        O projeto será analisado pelas comissões de Seguridade Social e Família; e de Constituição e Justiça e de Cidadania. Depois seguirá para o Plenário.Saiba mais sobre a tramitação de projetos de leiDa Reportagem/RMEdição – Roberto SeabraCom informações da Agência Senado",13
